{
  "id": "A",
  "domain": "municipal waste collection contract",
  "issue": "Contractor service logs and council fleet telemetry record different collection dates for the same 14 rounds in the Autumn period.",
  "evidence": "Both record sets held and compared; discrepancy confirmed on sampling of 14 of 60 rounds.",
  "chronology": "Autumn collection period; discrepancy identified at quarterly reconciliation.",
  "intended_use": "contract assurance review",
  "authorising_instrument": null
}
