{
  "id": "E",
  "domain": "freight and logistics operator, driver fatigue training",
  "issue": "Annual fatigue-management training completion is reported at 100 per cent, but the only supporting record is a summary spreadsheet with no underlying attendance or assessment data.",
  "evidence": "Summary spreadsheet held; source data not located and no system of record identified.",
  "chronology": "Reporting period Year 1; summary compiled at period end; source system unidentified.",
  "intended_use": "assurance review",
  "authorising_instrument": null
}
