{
  "id": "C",
  "domain": "professional association standards committee",
  "issue": "An approved policy on automated analysis tools is complete and correctly minuted, but no accountable owner was recorded and no review has occurred across three scheduled cycles.",
  "evidence": "Policy register, committee minutes and review calendar, all complete and mutually consistent.",
  "chronology": "Adoption Year 1; scheduled reviews Years 2, 3 and 4 — none held.",
  "intended_use": "governance maturity assessment",
  "authorising_instrument": null
}
