{
  "id": "D",
  "domain": "regional museum collection condition-report register",
  "issue": "No condition reports are held for the earliest three years of operation.",
  "evidence": "Internal audit sampling; retention schedule and signed disposal certificate located.",
  "chronology": "Operating years 1-3; disposal authorised and executed in year 10.",
  "intended_use": "records governance review",
  "authorising_instrument": "Retention schedule cl. 4.2; disposal certificate on file"
}
